1,https://ar-media.hptiendaenlinea.com/catalog/product/cache/b3b166914d87ce343d4dc5ec5117b502/4/8/482T9LA-1_T1632518960.png,Notebook HP 14" 4GB 256GB Intel Core i3 14-CF2533LA
1,https://ar-media.hptiendaenlinea.com/catalog/product/cache/b3b166914d87ce343d4dc5ec5117b502/3/1/310G4LA-1_T1643307273.png,Notebook HP 14-dk1016la AMD Athlon Silver 3050U 4GB 256GB SSD 14"
1,https://ar-media.hptiendaenlinea.com/catalog/product/cache/b3b166914d87ce343d4dc5ec5117b502/7/F/7FR21A-1_T1601584671.png,Impresora Multifunción HP Deskjet 2775
1,https://ar-media.hptiendaenlinea.com/catalog/product/cache/b3b166914d87ce343d4dc5ec5117b502/1/4/140Q7AA-1_T1632515228.png,All-in-One HP 22-df0005la AMD Athlon 3150U 4GB 256GB SSD 21.5"
2,https://www.casadelaudio.com/Image/0/400_400-156-mor-524_(11).png,Celular Libre Motorola G60s Aqua
2,celu1.png,Celular Samsung Galaxy A02 32 GB Negro
2,celu2.png,Celular Samsung Galaxy A52 128 GB Blanco
2,celu3.png,Celular Samsung 64" A32 4/128 Black
3,https://ar-media.hptiendaenlinea.com/catalog/product/cache/b3b166914d87ce343d4dc5ec5117b502/4/P/4P4F8AA-1_T1644530378.png,Mouse para juegos HyperX Negro
3,https://ar-media.hptiendaenlinea.com/catalog/product/cache/b3b166914d87ce343d4dc5ec5117b502/4/P/4P4F5AI-2_T1644530332.png,Teclado para juegos HyperX Alloy Core RGB
3,https://ar-media.hptiendaenlinea.com/catalog/product/cache/b3b166914d87ce343d4dc5ec5117b502/4/P/4P5L7AA-1_T1644529709.png,Auriculares para juegos HyperX Cloud Stinger Core
3,https://ar-media.hptiendaenlinea.com/catalog/product/cache/b3b166914d87ce343d4dc5ec5117b502/4/P/4P5P6AA-1_T1644529841.png,Micrófono HyperX QuadCast USB